Sheet: This_file_license
A1: This file is under the following license
A2: Copyright 2016 by Giuseppe Castagno giuseppe.castagno@acca-esse.eu
A4: This Source Code Form is subject to the terms of the Mozilla
A5: Public License, v. 2.0. If a copy of the MPL was not distributed
A6: with this file, You can obtain one at https://mozilla.org/MPL/2.0/.

Sheet: Readme
A1: First line: ignored wen converting, first column: comments, converted into element comment
A8: all the data record start on row 3
A11: The sheet named 'Extension_main_license' contains the main license of the extension, in full text

Sheet: File_header
A2: progressive number of line, the creation macro will stop when first column is empty. Numerical value (NOT a text!) | C2: data to be emitted
A3: 1 | C3: <?xml version='1.0' encoding='UTF-8'?>
A4: 2 | C4: <!--
A5: 3 | C5: Copyrigth 2016 by Giuseppe Castagno This Source Code Form is subject to the terms of the Mozilla Public License, v. 2.0. If a copy of the MPL was not distributed with this file, You can obtain one at https://mozilla.org/MPL/2.0/.
A6: 4 | C6: -->
A7: 5 | C7: <oor:component-data xmlns:oor="http://openoffice.org/2001/registry"
A8: 6 | C8: xmlns:xs="http://www.w3.org/2001/XMLSchema" xmlns:xsi="http://www.w3.org/2001/XMLSchema-instance"
A9: 7 | C9: oor:package="@WEBIDENTBASE@.@NAME@" oor:name="Configuration" >

Sheet: Strings
A1: internal id, fixed, used to sort back to the standard position. This id is not used in conversion, governs the sequence the messages are emitted the conversion stops when this column is empty | B1: comment | C1: internal id used by the extension
B2: this row contains the ISO language id ====----> | D2: en | E2: it
A3: 1 | B3: ISO code, used internally | C3: id_iso_lang_code | D3: en | E3: it
A4: of:=[.A3]+1 -> 2 | B4: name of the extension, ignored when accessing the menu. To be put manually in description.xml file | C4: id_descr | D4: LoGlobalLog | E4: LoGlobalLog
A5: of:=[.A4]+1 -> 3 | B5: general id for cancel button | C5: id_cancel | D5: Cancel | E5: Annulla
A6: of:=[.A5]+1 -> 4 | B6: general id for No button | C6: id_pb_no | D6: No | E6: No
A7: of:=[.A6]+1 -> 5 | B7: general id for OK button | C7: id_ok | D7: Ok | E7: Ok
A8: of:=[.A7]+1 -> 6 | B8: general id for Yes button | C8: id_pb_yes | D8: Yes | E8: Sì
A9: of:=[.A8]+1 -> 7 | B9: about box menu, not used in messages, for translation only | C9: id_about_menu | D9: About LoGlobalLog… | E9: Informazioni su LoGlobalLog…
A10: of:=[.A9]+1 -> 8 | B10: about box | C10: id_about_title | D10: About LoGlobalLog | E10: Informazioni su LoGlobalLog
A11: of:=[.A10]+1 -> 9 | C11: id_about_mex | D11: LoGlobalLog A LibreOffice singleton Java logger. (@WEBIDENTBASE@.@NAME@) Built with @JAVA_VERS@ on @BUILD_TIME@ Rev. @REVISION@. Licensed under MPL 2.0. Copyright 2016 Giuseppe Castagno | E11: LoGlobalLog A LibreOffice singleton Java logger. (@WEBIDENTBASE@.@NAME@) Compilato con @JAVA_VERS@ il @BUILD_TIME@ Rev. @REVISION@. Concesso in licenza secondo MPL 2.0. Copyright 2016 Giuseppe castagno
A12: of:=[.A11]+1 -> 10 | C12: id_error_extension | D12: GlobalLogger extension error | E12: Errore estensione GlobalLogger
A13: of:=[.A12]+1 -> 11 | B13: Credits | C13: id_credits | D13: Credits Giuseppe Castagno, developer | E13: Credits Giuseppe Castagno, sviluppatore
A14: of:=[.A13]+1 -> 12 | B14: Display license button | C14: id_show_license | D14: Show license | E14: Mostra licenza
A15: of:=[.A14]+1 -> 13 | B15: License display dialog title | C15: id_title_show_license | D15: Extension license | E15: Licenza dell'estensione

Sheet: Extension_main_license
A1: internal id, fixed, used to sort back to the standard position. This id is not used in conversion, governs the sequence the messages are emitted the conversion stops when this column is empty | B1: comment | C1: internal id used by the extension | D1: first language ISO id
B2: this row contains the ISO language id | D2: en
B3: this row contains the number of lines the license is made of, starting from row 4 | D3: 380
A4: 1 | B4: Main license of the extension | C4: id_main_license | D4: LoGlobalLog user license
A5: of:=[.A4]+1 -> 2
A6: of:=[.A5]+1 -> 3 | D6: This product is made available subject to the terms of the Mozilla Public
A7: of:=[.A6]+1 -> 4 | D7: License, v. 2.0. A copy of the MPL Version 2 license can be found below:
A8: of:=[.A7]+1 -> 5
A9: of:=[.A8]+1 -> 6 | D9: Mozilla Public License Version 2.0
A10: of:=[.A9]+1 -> 7 | D10: ==================================
A11: of:=[.A10]+1 -> 8
A12: of:=[.A11]+1 -> 9 | D12: 1. Definitions
A13: of:=[.A12]+1 -> 10 | D13: --------------
A14: of:=[.A13]+1 -> 11
A15: of:=[.A14]+1 -> 12 | D15: 1.1. "Contributor"
A16: of:=[.A15]+1 -> 13 | D16: means each individual or legal entity that creates, contributes to
A17: of:=[.A16]+1 -> 14 | D17: the creation of, or owns Covered Software.
A18: of:=[.A17]+1 -> 15
A19: of:=[.A18]+1 -> 16 | D19: 1.2. "Contributor Version"
A20: of:=[.A19]+1 -> 17 | D20: means the combination of the Contributions of others (if any) used
A21: of:=[.A20]+1 -> 18 | D21: by a Contributor and that particular Contributor's Contribution.
A22: of:=[.A21]+1 -> 19
A23: of:=[.A22]+1 -> 20 | D23: 1.3. "Contribution"
A24: of:=[.A23]+1 -> 21 | D24: means Covered Software of a particular Contributor.
A25: of:=[.A24]+1 -> 22
A26: of:=[.A25]+1 -> 23 | D26: 1.4. "Covered Software"
A27: of:=[.A26]+1 -> 24 | D27: means Source Code Form to which the initial Contributor has attached
A28: of:=[.A27]+1 -> 25 | D28: the notice in Exhibit A, the Executable Form of such Source Code
A29: of:=[.A28]+1 -> 26 | D29: Form, and Modifications of such Source Code Form, in each case
A30: of:=[.A29]+1 -> 27 | D30: including portions thereof.
A31: of:=[.A30]+1 -> 28
A32: of:=[.A31]+1 -> 29 | D32: 1.5. "Incompatible With Secondary Licenses"
A33: of:=[.A32]+1 -> 30 | D33: means
A34: of:=[.A33]+1 -> 31
A35: of:=[.A34]+1 -> 32 | D35: (a) that the initial Contributor has attached the notice described
A36: of:=[.A35]+1 -> 33 | D36: in Exhibit B to the Covered Software; or
A37: of:=[.A36]+1 -> 34
A38: of:=[.A37]+1 -> 35 | D38: (b) that the Covered Software was made available under the terms of
A39: of:=[.A38]+1 -> 36 | D39: version 1.1 or earlier of the License, but not also under the
A40: of:=[.A39]+1 -> 37 | D40: terms of a Secondary License.
A41: of:=[.A40]+1 -> 38
A42: of:=[.A41]+1 -> 39 | D42: 1.6. "Executable Form"
A43: of:=[.A42]+1 -> 40 | D43: means any form of the work other than Source Code Form.
A44: of:=[.A43]+1 -> 41
A45: of:=[.A44]+1 -> 42 | D45: 1.7. "Larger Work"
A46: of:=[.A45]+1 -> 43 | D46: means a work that combines Covered Software with other material, in
A47: of:=[.A46]+1 -> 44 | D47: a separate file or files, that is not Covered Software.
A48: of:=[.A47]+1 -> 45
A49: of:=[.A48]+1 -> 46 | D49: 1.8. "License"
A50: of:=[.A49]+1 -> 47 | D50: means this document.
A51: of:=[.A50]+1 -> 48
A52: of:=[.A51]+1 -> 49 | D52: 1.9. "Licensable"
A53: of:=[.A52]+1 -> 50 | D53: means having the right to grant, to the maximum extent possible,
A54: of:=[.A53]+1 -> 51 | D54: whether at the time of the initial grant or subsequently, any and
A55: of:=[.A54]+1 -> 52 | D55: all of the rights conveyed by this License.
A56: of:=[.A55]+1 -> 53
A57: of:=[.A56]+1 -> 54 | D57: 1.10. "Modifications"
A58: of:=[.A57]+1 -> 55 | D58: means any of the following:
A59: of:=[.A58]+1 -> 56
A60: of:=[.A59]+1 -> 57 | D60: (a) any file in Source Code Form that results from an addition to,
A61: of:=[.A60]+1 -> 58 | D61: deletion from, or modification of the contents of Covered
A62: of:=[.A61]+1 -> 59 | D62: Software; or
A63: of:=[.A62]+1 -> 60
A64: of:=[.A63]+1 -> 61 | D64: (b) any new file in Source Code Form that contains any Covered
A65: of:=[.A64]+1 -> 62 | D65: Software.
A66: of:=[.A65]+1 -> 63
A67: of:=[.A66]+1 -> 64 | D67: 1.11. "Patent Claims" of a Contributor
A68: of:=[.A67]+1 -> 65 | D68: means any patent claim(s), including without limitation, method,
A69: of:=[.A68]+1 -> 66 | D69: process, and apparatus claims, in any patent Licensable by such
A70: of:=[.A69]+1 -> 67 | D70: Contributor that would be infringed, but for the grant of the
A71: of:=[.A70]+1 -> 68 | D71: License, by the making, using, selling, offering for sale, having
A72: of:=[.A71]+1 -> 69 | D72: made, import, or transfer of either its Contributions or its
A73: of:=[.A72]+1 -> 70 | D73: Contributor Version.
A74: of:=[.A73]+1 -> 71
A75: of:=[.A74]+1 -> 72 | D75: 1.12. "Secondary License"
A76: of:=[.A75]+1 -> 73 | D76: means either the GNU General Public License, Version 2.0, the GNU
A77: of:=[.A76]+1 -> 74 | D77: Lesser General Public License, Version 2.1, the GNU Affero General
A78: of:=[.A77]+1 -> 75 | D78: Public License, Version 3.0, or any later versions of those
A79: of:=[.A78]+1 -> 76 | D79: licenses.
A80: of:=[.A79]+1 -> 77
A81: of:=[.A80]+1 -> 78 | D81: 1.13. "Source Code Form"
A82: of:=[.A81]+1 -> 79 | D82: means the form of the work preferred for making modifications.
A83: of:=[.A82]+1 -> 80
A84: of:=[.A83]+1 -> 81 | D84: 1.14. "You" (or "Your")
A85: of:=[.A84]+1 -> 82 | D85: means an individual or a legal entity exercising rights under this
A86: of:=[.A85]+1 -> 83 | D86: License. For legal entities, "You" includes any entity that
A87: of:=[.A86]+1 -> 84 | D87: controls, is controlled by, or is under common control with You. For
A88: of:=[.A87]+1 -> 85 | D88: purposes of this definition, "control" means (a) the power, direct
A89: of:=[.A88]+1 -> 86 | D89: or indirect, to cause the direction or management of such entity,
A90: of:=[.A89]+1 -> 87 | D90: whether by contract or otherwise, or (b) ownership of more than
A91: of:=[.A90]+1 -> 88 | D91: fifty percent (50%) of the outstanding shares or beneficial
A92: of:=[.A91]+1 -> 89 | D92: ownership of such entity.
A93: of:=[.A92]+1 -> 90
A94: of:=[.A93]+1 -> 91 | D94: 2. License Grants and Conditions
A95: of:=[.A94]+1 -> 92 | D95: --------------------------------
A96: of:=[.A95]+1 -> 93
A97: of:=[.A96]+1 -> 94 | D97: 2.1. Grants
A98: of:=[.A97]+1 -> 95
A99: of:=[.A98]+1 -> 96 | D99: Each Contributor hereby grants You a world-wide, royalty-free,
A100: of:=[.A99]+1 -> 97 | D100: non-exclusive license:
A101: of:=[.A100]+1 -> 98
A102: of:=[.A101]+1 -> 99 | D102: (a) under intellectual property rights (other than patent or trademark)
A103: of:=[.A102]+1 -> 100 | D103: Licensable by such Contributor to use, reproduce, make available,
A104: of:=[.A103]+1 -> 101 | D104: modify, display, perform, distribute, and otherwise exploit its
A105: of:=[.A104]+1 -> 102 | D105: Contributions, either on an unmodified basis, with Modifications, or
A106: of:=[.A105]+1 -> 103 | D106: as part of a Larger Work; and
A107: of:=[.A106]+1 -> 104
A108: of:=[.A107]+1 -> 105 | D108: (b) under Patent Claims of such Contributor to make, use, sell, offer
A109: of:=[.A108]+1 -> 106 | D109: for sale, have made, import, and otherwise transfer either its
A110: of:=[.A109]+1 -> 107 | D110: Contributions or its Contributor Version.
A111: of:=[.A110]+1 -> 108
A112: of:=[.A111]+1 -> 109 | D112: 2.2. Effective Date
A113: of:=[.A112]+1 -> 110
A114: of:=[.A113]+1 -> 111 | D114: The licenses granted in Section 2.1 with respect to any Contribution
A115: of:=[.A114]+1 -> 112 | D115: become effective for each Contribution on the date the Contributor first
A116: of:=[.A115]+1 -> 113 | D116: distributes such Contribution.
A117: of:=[.A116]+1 -> 114
A118: of:=[.A117]+1 -> 115 | D118: 2.3. Limitations on Grant Scope
A119: of:=[.A118]+1 -> 116
A120: of:=[.A119]+1 -> 117 | D120: The licenses granted in this Section 2 are the only rights granted under
A121: of:=[.A120]+1 -> 118 | D121: this License. No additional rights or licenses will be implied from the
A122: of:=[.A121]+1 -> 119 | D122: distribution or licensing of Covered Software under this License.
A123: of:=[.A122]+1 -> 120 | D123: Notwithstanding Section 2.1(b) above, no patent license is granted by a
A124: of:=[.A123]+1 -> 121 | D124: Contributor:
A125: of:=[.A124]+1 -> 122
A126: of:=[.A125]+1 -> 123 | D126: (a) for any code that a Contributor has removed from Covered Software;
A127: of:=[.A126]+1 -> 124 | D127: or
A128: of:=[.A127]+1 -> 125
A129: of:=[.A128]+1 -> 126 | D129: (b) for infringements caused by: (i) Your and any other third party's
A130: of:=[.A129]+1 -> 127 | D130: modifications of Covered Software, or (ii) the combination of its
A131: of:=[.A130]+1 -> 128 | D131: Contributions with other software (except as part of its Contributor
A132: of:=[.A131]+1 -> 129 | D132: Version); or
A133: of:=[.A132]+1 -> 130
A134: of:=[.A133]+1 -> 131 | D134: (c) under Patent Claims infringed by Covered Software in the absence of
A135: of:=[.A134]+1 -> 132 | D135: its Contributions.
A136: of:=[.A135]+1 -> 133
A137: of:=[.A136]+1 -> 134 | D137: This License does not grant any rights in the trademarks, service marks,
A138: of:=[.A137]+1 -> 135 | D138: or logos of any Contributor (except as may be necessary to comply with
A139: of:=[.A138]+1 -> 136 | D139: the notice requirements in Section 3.4).
A140: of:=[.A139]+1 -> 137
A141: of:=[.A140]+1 -> 138 | D141: 2.4. Subsequent Licenses
A142: of:=[.A141]+1 -> 139
A143: of:=[.A142]+1 -> 140 | D143: No Contributor makes additional grants as a result of Your choice to
A144: of:=[.A143]+1 -> 141 | D144: distribute the Covered Software under a subsequent version of this
A145: of:=[.A144]+1 -> 142 | D145: License (see Section 10.2) or under the terms of a Secondary License (if
A146: of:=[.A145]+1 -> 143 | D146: permitted under the terms of Section 3.3).
A147: of:=[.A146]+1 -> 144
A148: of:=[.A147]+1 -> 145 | D148: 2.5. Representation
A149: of:=[.A148]+1 -> 146
A150: of:=[.A149]+1 -> 147 | D150: Each Contributor represents that the Contributor believes its
A151: of:=[.A150]+1 -> 148 | D151: Contributions are its original creation(s) or it has sufficient rights
A152: of:=[.A151]+1 -> 149 | D152: to grant the rights to its Contributions conveyed by this License.
A153: of:=[.A152]+1 -> 150
A154: of:=[.A153]+1 -> 151 | D154: 2.6. Fair Use
A155: of:=[.A154]+1 -> 152
A156: of:=[.A155]+1 -> 153 | D156: This License is not intended to limit any rights You have under
A157: of:=[.A156]+1 -> 154 | D157: applicable copyright doctrines of fair use, fair dealing, or other
A158: of:=[.A157]+1 -> 155 | D158: equivalents.
A159: of:=[.A158]+1 -> 156
A160: of:=[.A159]+1 -> 157 | D160: 2.7. Conditions
A161: of:=[.A160]+1 -> 158
A162: of:=[.A161]+1 -> 159 | D162: Sections 3.1, 3.2, 3.3, and 3.4 are conditions of the licenses granted
A163: of:=[.A162]+1 -> 160 | D163: in Section 2.1.
A164: of:=[.A163]+1 -> 161
A165: of:=[.A164]+1 -> 162 | D165: 3. Responsibilities
A166: of:=[.A165]+1 -> 163 | D166: -------------------
A167: of:=[.A166]+1 -> 164
A168: of:=[.A167]+1 -> 165 | D168: 3.1. Distribution of Source Form
A169: of:=[.A168]+1 -> 166
A170: of:=[.A169]+1 -> 167 | D170: All distribution of Covered Software in Source Code Form, including any
A171: of:=[.A170]+1 -> 168 | D171: Modifications that You create or to which You contribute, must be under
A172: of:=[.A171]+1 -> 169 | D172: the terms of this License. You must inform recipients that the Source
A173: of:=[.A172]+1 -> 170 | D173: Code Form of the Covered Software is governed by the terms of this
A174: of:=[.A173]+1 -> 171 | D174: License, and how they can obtain a copy of this License. You may not
A175: of:=[.A174]+1 -> 172 | D175: attempt to alter or restrict the recipients' rights in the Source Code
A176: of:=[.A175]+1 -> 173 | D176: Form.
A177: of:=[.A176]+1 -> 174
A178: of:=[.A177]+1 -> 175 | D178: 3.2. Distribution of Executable Form
A179: of:=[.A178]+1 -> 176
A180: of:=[.A179]+1 -> 177 | D180: If You distribute Covered Software in Executable Form then:
A181: of:=[.A180]+1 -> 178
A182: of:=[.A181]+1 -> 179 | D182: (a) such Covered Software must also be made available in Source Code
A183: of:=[.A182]+1 -> 180 | D183: Form, as described in Section 3.1, and You must inform recipients of
A184: of:=[.A183]+1 -> 181 | D184: the Executable Form how they can obtain a copy of such Source Code
A185: of:=[.A184]+1 -> 182 | D185: Form by reasonable means in a timely manner, at a charge no more
A186: of:=[.A185]+1 -> 183 | D186: than the cost of distribution to the recipient; and
A187: of:=[.A186]+1 -> 184
A188: of:=[.A187]+1 -> 185 | D188: (b) You may distribute such Executable Form under the terms of this
A189: of:=[.A188]+1 -> 186 | D189: License, or sublicense it under different terms, provided that the
A190: of:=[.A189]+1 -> 187 | D190: license for the Executable Form does not attempt to limit or alter
A191: of:=[.A190]+1 -> 188 | D191: the recipients' rights in the Source Code Form under this License.
A192: of:=[.A191]+1 -> 189
A193: of:=[.A192]+1 -> 190 | D193: 3.3. Distribution of a Larger Work
A194: of:=[.A193]+1 -> 191
A195: of:=[.A194]+1 -> 192 | D195: You may create and distribute a Larger Work under terms of Your choice,
A196: of:=[.A195]+1 -> 193 | D196: provided that You also comply with the requirements of this License for
A197: of:=[.A196]+1 -> 194 | D197: the Covered Software. If the Larger Work is a combination of Covered
A198: of:=[.A197]+1 -> 195 | D198: Software with a work governed by one or more Secondary Licenses, and the
A199: of:=[.A198]+1 -> 196 | D199: Covered Software is not Incompatible With Secondary Licenses, this
A200: of:=[.A199]+1 -> 197 | D200: License permits You to additionally distribute such Covered Software
A201: of:=[.A200]+1 -> 198 | D201: under the terms of such Secondary License(s), so that the recipient of
A202: of:=[.A201]+1 -> 199 | D202: the Larger Work may, at their option, further distribute the Covered
A203: of:=[.A202]+1 -> 200 | D203: Software under the terms of either this License or such Secondary
A204: of:=[.A203]+1 -> 201 | D204: License(s).
A205: of:=[.A204]+1 -> 202
A206: of:=[.A205]+1 -> 203 | D206: 3.4. Notices
A207: of:=[.A206]+1 -> 204
A208: of:=[.A207]+1 -> 205 | D208: You may not remove or alter the substance of any license notices
A209: of:=[.A208]+1 -> 206 | D209: (including copyright notices, patent notices, disclaimers of warranty,
A210: of:=[.A209]+1 -> 207 | D210: or limitations of liability) contained within the Source Code Form of
A211: of:=[.A210]+1 -> 208 | D211: the Covered Software, except that You may alter any license notices to
A212: of:=[.A211]+1 -> 209 | D212: the extent required to remedy known factual inaccuracies.
A213: of:=[.A212]+1 -> 210
A214: of:=[.A213]+1 -> 211 | D214: 3.5. Application of Additional Terms
A215: of:=[.A214]+1 -> 212
A216: of:=[.A215]+1 -> 213 | D216: You may choose to offer, and to charge a fee for, warranty, support,
A217: of:=[.A216]+1 -> 214 | D217: indemnity or liability obligations to one or more recipients of Covered
A218: of:=[.A217]+1 -> 215 | D218: Software. However, You may do so only on Your own behalf, and not on
A219: of:=[.A218]+1 -> 216 | D219: behalf of any Contributor. You must make it absolutely clear that any
A220: of:=[.A219]+1 -> 217 | D220: such warranty, support, indemnity, or liability obligation is offered by
A221: of:=[.A220]+1 -> 218 | D221: You alone, and You hereby agree to indemnify every Contributor for any
A222: of:=[.A221]+1 -> 219 | D222: liability incurred by such Contributor as a result of warranty, support,
A223: of:=[.A222]+1 -> 220 | D223: indemnity or liability terms You offer. You may include additional
A224: of:=[.A223]+1 -> 221 | D224: disclaimers of warranty and limitations of liability specific to any
A225: of:=[.A224]+1 -> 222 | D225: jurisdiction.
A226: of:=[.A225]+1 -> 223
A227: of:=[.A226]+1 -> 224 | D227: 4. Inability to Comply Due to Statute or Regulation
A228: of:=[.A227]+1 -> 225 | D228: ---------------------------------------------------
A229: of:=[.A228]+1 -> 226
A230: of:=[.A229]+1 -> 227 | D230: If it is impossible for You to comply with any of the terms of this
A231: of:=[.A230]+1 -> 228 | D231: License with respect to some or all of the Covered Software due to
A232: of:=[.A231]+1 -> 229 | D232: statute, judicial order, or regulation then You must: (a) comply with
A233: of:=[.A232]+1 -> 230 | D233: the terms of this License to the maximum extent possible; and (b)
A234: of:=[.A233]+1 -> 231 | D234: describe the limitations and the code they affect. Such description must
A235: of:=[.A234]+1 -> 232 | D235: be placed in a text file included with all distributions of the Covered
A236: of:=[.A235]+1 -> 233 | D236: Software under this License. Except to the extent prohibited by statute
A237: of:=[.A236]+1 -> 234 | D237: or regulation, such description must be sufficiently detailed for a
A238: of:=[.A237]+1 -> 235 | D238: recipient of ordinary skill to be able to understand it.
A239: of:=[.A238]+1 -> 236
A240: of:=[.A239]+1 -> 237 | D240: 5. Termination
A241: of:=[.A240]+1 -> 238 | D241: --------------
A242: of:=[.A241]+1 -> 239
A243: of:=[.A242]+1 -> 240 | D243: 5.1. The rights granted under this License will terminate automatically
A244: of:=[.A243]+1 -> 241 | D244: if You fail to comply with any of its terms. However, if You become
A245: of:=[.A244]+1 -> 242 | D245: compliant, then the rights granted under this License from a particular
A246: of:=[.A245]+1 -> 243 | D246: Contributor are reinstated (a) provisionally, unless and until such
A247: of:=[.A246]+1 -> 244 | D247: Contributor explicitly and finally terminates Your grants, and (b) on an
A248: of:=[.A247]+1 -> 245 | D248: ongoing basis, if such Contributor fails to notify You of the
A249: of:=[.A248]+1 -> 246 | D249: non-compliance by some reasonable means prior to 60 days after You have
A250: of:=[.A249]+1 -> 247 | D250: come back into compliance. Moreover, Your grants from a particular
A251: of:=[.A250]+1 -> 248 | D251: Contributor are reinstated on an ongoing basis if such Contributor
A252: of:=[.A251]+1 -> 249 | D252: notifies You of the non-compliance by some reasonable means, this is the
A253: of:=[.A252]+1 -> 250 | D253: first time You have received notice of non-compliance with this License
A254: of:=[.A253]+1 -> 251 | D254: from such Contributor, and You become compliant prior to 30 days after
A255: of:=[.A254]+1 -> 252 | D255: Your receipt of the notice.
A256: of:=[.A255]+1 -> 253
A257: of:=[.A256]+1 -> 254 | D257: 5.2. If You initiate litigation against any entity by asserting a patent
A258: of:=[.A257]+1 -> 255 | D258: infringement claim (excluding declaratory judgment actions,
A259: of:=[.A258]+1 -> 256 | D259: counter-claims, and cross-claims) alleging that a Contributor Version
A260: of:=[.A259]+1 -> 257 | D260: directly or indirectly infringes any patent, then the rights granted to
A261: of:=[.A260]+1 -> 258 | D261: You by any and all Contributors for the Covered Software under Section
A262: of:=[.A261]+1 -> 259 | D262: 2.1 of this License shall terminate.
A263: of:=[.A262]+1 -> 260
A264: of:=[.A263]+1 -> 261 | D264: 5.3. In the event of termination under Sections 5.1 or 5.2 above, all
A265: of:=[.A264]+1 -> 262 | D265: end user license agreements (excluding distributors and resellers) which
A266: of:=[.A265]+1 -> 263 | D266: have been validly granted by You or Your distributors under this License
A267: of:=[.A266]+1 -> 264 | D267: prior to termination shall survive termination.
A268: of:=[.A267]+1 -> 265
A269: of:=[.A268]+1 -> 266 | D269: ************************************************************************
A270: of:=[.A269]+1 -> 267 | D270: * *
A271: of:=[.A270]+1 -> 268 | D271: * 6. Disclaimer of Warranty *
A272: of:=[.A271]+1 -> 269 | D272: * ------------------------- *
A273: of:=[.A272]+1 -> 270 | D273: * *
A274: of:=[.A273]+1 -> 271 | D274: * Covered Software is provided under this License on an "as is" *
A275: of:=[.A274]+1 -> 272 | D275: * basis, without warranty of any kind, either expressed, implied, or *
A276: of:=[.A275]+1 -> 273 | D276: * statutory, including, without limitation, warranties that the *
A277: of:=[.A276]+1 -> 274 | D277: * Covered Software is free of defects, merchantable, fit for a *
A278: of:=[.A277]+1 -> 275 | D278: * particular purpose or non-infringing. The entire risk as to the *
A279: of:=[.A278]+1 -> 276 | D279: * quality and performance of the Covered Software is with You. *
A280: of:=[.A279]+1 -> 277 | D280: * Should any Covered Software prove defective in any respect, You *
A281: of:=[.A280]+1 -> 278 | D281: * (not any Contributor) assume the cost of any necessary servicing, *
A282: of:=[.A281]+1 -> 279 | D282: * repair, or correction. This disclaimer of warranty constitutes an *
A283: of:=[.A282]+1 -> 280 | D283: * essential part of this License. No use of any Covered Software is *
A284: of:=[.A283]+1 -> 281 | D284: * authorized under this License except under this disclaimer. *
A285: of:=[.A284]+1 -> 282 | D285: * *
A286: of:=[.A285]+1 -> 283 | D286: ************************************************************************
A287: of:=[.A286]+1 -> 284
A288: of:=[.A287]+1 -> 285 | D288: ************************************************************************
A289: of:=[.A288]+1 -> 286 | D289: * *
A290: of:=[.A289]+1 -> 287 | D290: * 7. Limitation of Liability *
A291: of:=[.A290]+1 -> 288 | D291: * -------------------------- *
A292: of:=[.A291]+1 -> 289 | D292: * *
A293: of:=[.A292]+1 -> 290 | D293: * Under no circumstances and under no legal theory, whether tort *
A294: of:=[.A293]+1 -> 291 | D294: * (including negligence), contract, or otherwise, shall any *
A295: of:=[.A294]+1 -> 292 | D295: * Contributor, or anyone who distributes Covered Software as *
A296: of:=[.A295]+1 -> 293 | D296: * permitted above, be liable to You for any direct, indirect, *
A297: of:=[.A296]+1 -> 294 | D297: * special, incidental, or consequential damages of any character *
A298: of:=[.A297]+1 -> 295 | D298: * including, without limitation, damages for lost profits, loss of *
A299: of:=[.A298]+1 -> 296 | D299: * goodwill, work stoppage, computer failure or malfunction, or any *
A300: of:=[.A299]+1 -> 297 | D300: * and all other commercial damages or losses, even if such party *
A301: of:=[.A300]+1 -> 298 | D301: * shall have been informed of the possibility of such damages. This *
A302: of:=[.A301]+1 -> 299 | D302: * limitation of liability shall not apply to liability for death or *
A303: of:=[.A302]+1 -> 300 | D303: * personal injury resulting from such party's negligence to the *
A304: of:=[.A303]+1 -> 301 | D304: * extent applicable law prohibits such limitation. Some *
A305: of:=[.A304]+1 -> 302 | D305: * jurisdictions do not allow the exclusion or limitation of *
A306: of:=[.A305]+1 -> 303 | D306: * incidental or consequential damages, so this exclusion and *
A307: of:=[.A306]+1 -> 304 | D307: * limitation may not apply to You. *
A308: of:=[.A307]+1 -> 305 | D308: * *
A309: of:=[.A308]+1 -> 306 | D309: ************************************************************************
A310: of:=[.A309]+1 -> 307
A311: of:=[.A310]+1 -> 308 | D311: 8. Litigation
A312: of:=[.A311]+1 -> 309 | D312: -------------
A313: of:=[.A312]+1 -> 310
A314: of:=[.A313]+1 -> 311 | D314: Any litigation relating to this License may be brought only in the
A315: of:=[.A314]+1 -> 312 | D315: courts of a jurisdiction where the defendant maintains its principal
A316: of:=[.A315]+1 -> 313 | D316: place of business and such litigation shall be governed by laws of that
A317: of:=[.A316]+1 -> 314 | D317: jurisdiction, without reference to its conflict-of-law provisions.
A318: of:=[.A317]+1 -> 315 | D318: Nothing in this Section shall prevent a party's ability to bring
A319: of:=[.A318]+1 -> 316 | D319: cross-claims or counter-claims.
A320: of:=[.A319]+1 -> 317
A321: of:=[.A320]+1 -> 318 | D321: 9. Miscellaneous
A322: of:=[.A321]+1 -> 319 | D322: ----------------
A323: of:=[.A322]+1 -> 320
A324: of:=[.A323]+1 -> 321 | D324: This License represents the complete agreement concerning the subject
A325: of:=[.A324]+1 -> 322 | D325: matter hereof. If any provision of this License is held to be
A326: of:=[.A325]+1 -> 323 | D326: unenforceable, such provision shall be reformed only to the extent
A327: of:=[.A326]+1 -> 324 | D327: necessary to make it enforceable. Any law or regulation which provides
A328: of:=[.A327]+1 -> 325 | D328: that the language of a contract shall be construed against the drafter
A329: of:=[.A328]+1 -> 326 | D329: shall not be used to construe this License against a Contributor.
A330: of:=[.A329]+1 -> 327
A331: of:=[.A330]+1 -> 328 | D331: 10. Versions of the License
A332: of:=[.A331]+1 -> 329 | D332: ---------------------------
A333: of:=[.A332]+1 -> 330
A334: of:=[.A333]+1 -> 331 | D334: 10.1. New Versions
A335: of:=[.A334]+1 -> 332
A336: of:=[.A335]+1 -> 333 | D336: Mozilla Foundation is the license steward. Except as provided in Section
A337: of:=[.A336]+1 -> 334 | D337: 10.3, no one other than the license steward has the right to modify or
A338: of:=[.A337]+1 -> 335 | D338: publish new versions of this License. Each version will be given a
A339: of:=[.A338]+1 -> 336 | D339: distinguishing version number.
A340: of:=[.A339]+1 -> 337
A341: of:=[.A340]+1 -> 338 | D341: 10.2. Effect of New Versions
A342: of:=[.A341]+1 -> 339
A343: of:=[.A342]+1 -> 340 | D343: You may distribute the Covered Software under the terms of the version
A344: of:=[.A343]+1 -> 341 | D344: of the License under which You originally received the Covered Software,
A345: of:=[.A344]+1 -> 342 | D345: or under the terms of any subsequent version published by the license
A346: of:=[.A345]+1 -> 343 | D346: steward.
A347: of:=[.A346]+1 -> 344
A348: of:=[.A347]+1 -> 345 | D348: 10.3. Modified Versions
A349: of:=[.A348]+1 -> 346
A350: of:=[.A349]+1 -> 347 | D350: If you create software not governed by this License, and you want to
A351: of:=[.A350]+1 -> 348 | D351: create a new license for such software, you may create and use a
A352: of:=[.A351]+1 -> 349 | D352: modified version of this License if you rename the license and remove
A353: of:=[.A352]+1 -> 350 | D353: any references to the name of the license steward (except to note that
A354: of:=[.A353]+1 -> 351 | D354: such modified license differs from this License).
A355: of:=[.A354]+1 -> 352
A356: of:=[.A355]+1 -> 353 | D356: 10.4. Distributing Source Code Form that is Incompatible With Secondary
A357: of:=[.A356]+1 -> 354 | D357: Licenses
A358: of:=[.A357]+1 -> 355
A359: of:=[.A358]+1 -> 356 | D359: If You choose to distribute Source Code Form that is Incompatible With
A360: of:=[.A359]+1 -> 357 | D360: Secondary Licenses under the terms of this version of the License, the
A361: of:=[.A360]+1 -> 358 | D361: notice described in Exhibit B of this License must be attached.
A362: of:=[.A361]+1 -> 359
A363: of:=[.A362]+1 -> 360 | D363: Exhibit A - Source Code Form License Notice
A364: of:=[.A363]+1 -> 361 | D364: -------------------------------------------
A365: of:=[.A364]+1 -> 362
A366: of:=[.A365]+1 -> 363 | D366: This Source Code Form is subject to the terms of the Mozilla Public
A367: of:=[.A366]+1 -> 364 | D367: License, v. 2.0. If a copy of the MPL was not distributed with this
A368: of:=[.A367]+1 -> 365 | D368: file, You can obtain one at http://mozilla.org/MPL/2.0/.
A369: of:=[.A368]+1 -> 366
A370: of:=[.A369]+1 -> 367 | D370: If it is not possible or desirable to put the notice in a particular
A371: of:=[.A370]+1 -> 368 | D371: file, then You may include the notice in a location (such as a LICENSE
A372: of:=[.A371]+1 -> 369 | D372: file in a relevant directory) where a recipient would be likely to look
A373: of:=[.A372]+1 -> 370 | D373: for such a notice.
A374: of:=[.A373]+1 -> 371
A375: of:=[.A374]+1 -> 372 | D375: You may add additional accurate notices of copyright ownership.
A376: of:=[.A375]+1 -> 373
A377: of:=[.A376]+1 -> 374 | D377: Exhibit B - "Incompatible With Secondary Licenses" Notice
A378: of:=[.A377]+1 -> 375 | D378: ---------------------------------------------------------
A379: of:=[.A378]+1 -> 376
A380: of:=[.A379]+1 -> 377 | D380: This Source Code Form is "Incompatible With Secondary Licenses", as
A381: of:=[.A380]+1 -> 378 | D381: defined by the Mozilla Public License, v. 2.0.
A382: of:=[.A381]+1 -> 379
A383: of:=[.A382]+1 -> 380

Sheet: File_trailer
A3: 1 | C3: </oor:component-data>